{
  "manifestSchemaVersion": "1.1",
  "researchReleaseId": "11111111-1111-4111-8111-111111111111",
  "releaseLabel": "fixture-2026.10.03-001",
  "sourceBuildId": "aaaaaaaa-aaaa-4aaa-8aaa-aaaaaaaaaaaa",
  "compilerVersion": "fixture-compiler-1.1",
  "gitCommitSha": "0123456789abcdef0123456789abcdef01234567",
  "benchmarkVersion": "fixture-benchmark-1",
  "canonicalSerialization": "RFC8785_JSON_CANONICALIZATION_SCHEME",
  "hashAlgorithm": "SHA256",
  "components": [
    {
      "componentKind": "CORPUS",
      "researchObjectId": "bbbbbbbb-bbbb-4bbb-8bbb-bbbbbbbbbbbb",
      "componentVersion": "fixture-corpus-1",
      "contentHash": "1111111111111111111111111111111111111111111111111111111111111111",
      "componentOrder": 0
    },
    {
      "componentKind": "ANNOTATION_LAYER",
      "researchObjectId": "cccccccc-cccc-4ccc-8ccc-cccccccccccc",
      "componentVersion": "fixture-clause-layer-1",
      "contentHash": "2222222222222222222222222222222222222222222222222222222222222222",
      "componentOrder": 1
    },
    {
      "componentKind": "SEMANTIC_SET",
      "researchObjectId": "dddddddd-dddd-4ddd-8ddd-dddddddddddd",
      "componentVersion": "BODY_PART:v1-fixture",
      "contentHash": "3333333333333333333333333333333333333333333333333333333333333333",
      "componentOrder": 2
    },
    {
      "componentKind": "CONSTRUCTION",
      "researchObjectId": "eeeeeeee-eeee-4eee-8eee-eeeeeeeeeeee",
      "componentVersion": "PERCEPTION_VERB_LAMED_BODY_PART:v1-fixture",
      "contentHash": "4444444444444444444444444444444444444444444444444444444444444444",
      "componentOrder": 3
    }
  ]
}
